{
  "format": "ran-booster-package-blueprint",
  "version": 2,
  "packages": [
    {
      "type": "plugin",
      "identifier": "example/example.php",
      "display_name": "Example",
      "provider": "github",
      "provider_repository_id": "12345",
      "repository": "acme/example",
      "source": {
        "kind": "branch",
        "branch": "main",
        "subdirectory": null
      }
    }
  ],
  "credentials": []
}
