{
  "format": "ran-booster-package-blueprint",
  "version": 2,
  "packages": [
    {
      "type": "plugin",
      "identifier": "example/example.php",
      "display_name": "Example",
      "provider": "github",
      "provider_repository_id": "12345",
      "repository": "acme/example",
      "source": {
        "kind": "branch",
        "branch": "main",
        "subdirectory": null
      },
      "selection": {
        "commit": "aaaaaaaaaaaaaaaaaaaaaaaaaaaaaaaaaaaaaaaa"
      },
      "requirements": {
        "basis": "selected_package",
        "observed_identity": {
          "version": "1.2.0",
          "commit": "aaaaaaaaaaaaaaaaaaaaaaaaaaaaaaaaaaaaaaaa"
        },
        "declarations": {
          "requires_php": "8.2",
          "requires_wordpress": "6.9",
          "requires_plugins": []
        }
      }
    },
    {
      "type": "theme",
      "identifier": "example-theme",
      "display_name": "Example Theme",
      "provider": "github",
      "provider_repository_id": "98765",
      "repository": "acme/example-theme",
      "source": {
        "kind": "release_asset",
        "channel": "prerelease",
        "package_root": "example-theme",
        "metadata_file": "style.css"
      },
      "requirements": {
        "basis": "installed_headers",
        "observed_identity": {
          "version": "2.0.0-beta.1"
        },
        "declarations": {
          "requires_php": "8.1",
          "requires_wordpress": null,
          "parent_theme": null
        }
      }
    }
  ],
  "credentials": []
}
