{
  "format": "ran-booster-package-blueprint",
  "version": 2,
  "packages": [
    {
      "type": "plugin",
      "identifier": "example/example.php",
      "display_name": "Example",
      "provider": "github",
      "provider_repository_id": "67890",
      "repository": "acme/release-example",
      "source": {
        "kind": "release_asset",
        "channel": "stable",
        "package_root": "example",
        "metadata_file": "example.php"
      },
      "selection": {
        "release_id": "24680",
        "tag": "v1.2.0",
        "version": "1.2.0",
        "commit": "bbbbbbbbbbbbbbbbbbbbbbbbbbbbbbbbbbbbbbbb",
        "artifact_id": "13579",
        "artifact_sha256": "cccccccccccccccccccccccccccccccccccccccccccccccccccccccccccccccc",
        "artifact_size": 123456
      },
      "requirements": {
        "basis": "selected_package",
        "observed_identity": {
          "version": "1.2.0",
          "commit": "bbbbbbbbbbbbbbbbbbbbbbbbbbbbbbbbbbbbbbbb",
          "artifact_sha256": "cccccccccccccccccccccccccccccccccccccccccccccccccccccccccccccccc"
        },
        "declarations": {
          "requires_php": "8.1",
          "requires_wordpress": "6.8",
          "requires_plugins": [
            "woocommerce"
          ]
        }
      }
    }
  ],
  "credentials": []
}
